<!ELEMENT giant_config_file (setting)*>

  <!ELEMENT setting EMPTY>
  <!ATTLIST setting
      name   CDATA #REQUIRED
      value  CDATA #REQUIRED
    >
    
